{
  "$schema": "https://json-schema.org/draft/2020-12/schema",
  "$id": "https://pfem.local/schemas/retention_cycle_record.schema.json",
  "title": "PFEM Retention Cycle Records",
  "type": "object",
  "required": [
    "retention_cycle_record_id",
    "cycle_kind",
    "created_time",
    "node_id",
    "retention_schedule_closeout_record_id",
    "cycle_state",
    "final_outcome",
    "cycle_refs",
    "subject_refs",
    "basis_refs",
    "digest_algorithm",
    "cycle_ref_digest",
    "summarized_by_ref",
    "summary"
  ],
  "properties": {
    "retention_cycle_record_id": {
      "type": "string"
    },
    "cycle_kind": {
      "type": "string"
    },
    "created_time": {
      "type": "string"
    },
    "node_id": {
      "type": "string"
    },
    "retention_schedule_closeout_record_id": {
      "type": "string"
    },
    "cycle_state": {
      "type": "string"
    },
    "final_outcome": {
      "type": "string"
    },
    "cycle_refs": {
      "type": "array"
    },
    "subject_refs": {
      "type": "array"
    },
    "basis_refs": {
      "type": "array"
    },
    "digest_algorithm": {
      "type": "string"
    },
    "cycle_ref_digest": {
      "type": "string"
    },
    "summarized_by_ref": {
      "type": "string"
    },
    "summary": {
      "type": "string"
    }
  },
  "additionalProperties": true
}
